{
  "schema_version": "1.0.0",
  "generated_at": "2026-05-24T00:00:00Z",
  "generator": "fixture-r6-layer-violation",
  "codebase": {
    "classes": [],
    "interfaces": [],
    "events": [],
    "vcontainer": { "installers": [], "scopes": [] },
    "assemblies": [
      {
        "name": "Framework.Foo",
        "file": "HoleSphere/Assets/_Framework/Foo/Framework.Foo.asmdef",
        "source_file": "HoleSphere/Assets/_Framework/Foo/Framework.Foo.asmdef",
        "references": ["Games.Bar"],
        "platforms": { "include": [], "exclude": [] },
        "allowUnsafeCode": false,
        "defines": [],
        "confidence": "EXTRACTED"
      },
      {
        "name": "Games.Bar",
        "file": "HoleSphere/Assets/_GameFolders/Scripts/Games/Bar/Games.Bar.asmdef",
        "source_file": "HoleSphere/Assets/_GameFolders/Scripts/Games/Bar/Games.Bar.asmdef",
        "references": [],
        "platforms": { "include": [], "exclude": [] },
        "allowUnsafeCode": false,
        "defines": [],
        "confidence": "EXTRACTED"
      }
    ],
    "scenes": [],
    "prefabs": [],
    "mcp_extraction": { "status": "skipped", "skipped_reason": "FIXTURE" }
  },
  "validation": { "errors": [], "warnings": [] },
  "stats": { "scanned_files": 0, "cache_hits": 0, "build_ms": 0 }
}
